{
  "$schema": "https://json-schema.org/draft-07/schema#",
  "$id": "faithro:warp-audit/binary-audit-gate-03-identity-signature-evidence",
  "title": "WARP binary audit GATE 3 identity & signature evidence (real, invalidated pending repeat)",
  "description": "Evidencia REAL do GATE 3 (identidade do PE e assinatura Authenticode) apos a revisao corretiva 2P-E-C3-R1. O COMPLETED_PASS original foi SUSPENSO: status/outcome const EVIDENCE_INVALIDATED_PENDING_REPEAT. Corrige D1 (semantica de leitura estatica explicita, sem 'opened' ambiguo), D2 (size_of_optional_header=267 == magic PE32 marcado MEASUREMENT_REQUIRES_RECONFIRMATION), D3 (parser versionado referenciado) e D4 (ferramenta disponivel x invocada; exit_code=null quando invoked=false). Preserva os fatos do GATE 2 e marca os campos do parser nao versionado como pendentes. Nenhuma nova materializacao/execucao.",
  "type": "object",
  "additionalProperties": false,
  "required": [
    "schema_version", "project", "stage", "record_type", "status", "outcome", "gate",
    "authorization_ref", "plan_ref", "gate_2_decision_ref", "gate_2_evidence_ref",
    "reviewed_parser_ref", "reviewed_parser_test_ref", "integration_ref",
    "original_execution", "corrective_review", "upstream_expected",
    "identity_reconfirmation", "pe_identity_observed", "authenticode_observed",
    "signature_semantics", "reviewed_parser", "tools", "security_assertions",
    "preserved_gate_2_facts", "pending_reconfirmation", "findings", "limitations",
    "rollback", "notes"
  ],
  "properties": {
    "schema_version": { "type": "integer", "const": 1 },
    "project": { "type": "string", "const": "WARP" },
    "stage": { "type": "string", "const": "2P-E-C3" },
    "record_type": { "type": "string", "const": "binary-audit-gate-03-identity-signature-evidence-real" },
    "status": { "type": "string", "const": "EVIDENCE_INVALIDATED_PENDING_REPEAT" },
    "outcome": { "type": "string", "const": "EVIDENCE_INVALIDATED_PENDING_REPEAT" },
    "gate": {
      "type": "object",
      "additionalProperties": false,
      "required": ["id", "name"],
      "properties": {
        "id": { "type": "integer", "const": 3 },
        "name": { "type": "string", "const": "IDENTITY_AND_SIGNATURE" }
      }
    },
    "authorization_ref": { "type": "object", "additionalProperties": false, "required": ["path"], "properties": { "path": { "type": "string", "minLength": 1 } } },
    "plan_ref": { "type": "object", "additionalProperties": false, "required": ["path"], "properties": { "path": { "type": "string", "minLength": 1 } } },
    "gate_2_decision_ref": { "type": "object", "additionalProperties": false, "required": ["path"], "properties": { "path": { "type": "string", "minLength": 1 } } },
    "gate_2_evidence_ref": { "type": "object", "additionalProperties": false, "required": ["path"], "properties": { "path": { "type": "string", "minLength": 1 } } },
    "reviewed_parser_ref": { "type": "object", "additionalProperties": false, "required": ["path"], "properties": { "path": { "type": "string", "minLength": 1 } } },
    "reviewed_parser_test_ref": { "type": "object", "additionalProperties": false, "required": ["path"], "properties": { "path": { "type": "string", "minLength": 1 } } },
    "integration_ref": {
      "type": "object",
      "additionalProperties": false,
      "required": ["pr", "squash_commit", "base_branch"],
      "properties": {
        "pr": { "type": "integer", "const": 50 },
        "squash_commit": { "type": "string", "const": "6ab37b2a7ae65fd6b4fdf184759b345cf9ce4bd6" },
        "base_branch": { "type": "string", "const": "dev" }
      }
    },
    "original_execution": {
      "type": "object",
      "additionalProperties": false,
      "required": [
        "note", "gate_3_started", "gate_3_completed", "execution_state", "started_at",
        "finished_at", "cleanup_at", "operator", "method", "network_scope",
        "timestamps_precision", "superseded_by_corrective_review"
      ],
      "properties": {
        "note": { "type": "string", "minLength": 1 },
        "gate_3_started": { "type": "boolean", "const": true },
        "gate_3_completed": { "type": "boolean", "const": true },
        "execution_state": { "type": "string", "const": "COMPLETED" },
        "started_at": { "type": "string", "pattern": "^[0-9]{4}-[0-9]{2}-[0-9]{2}T[0-9]{2}:[0-9]{2}:[0-9]{2}" },
        "finished_at": { "type": "string", "pattern": "^[0-9]{4}-[0-9]{2}-[0-9]{2}T[0-9]{2}:[0-9]{2}:[0-9]{2}" },
        "cleanup_at": { "type": "string", "pattern": "^[0-9]{4}-[0-9]{2}-[0-9]{2}T[0-9]{2}:[0-9]{2}:[0-9]{2}" },
        "operator": { "type": "string", "minLength": 2 },
        "method": { "type": "string", "const": "GITHUB_OFFICIAL_GIT_DATA_API_BLOB_BY_OID" },
        "network_scope": { "type": "string", "const": "GITHUB_OFFICIAL_ONLY" },
        "timestamps_precision": { "type": "string", "minLength": 1 },
        "superseded_by_corrective_review": { "type": "boolean", "const": true }
      }
    },
    "corrective_review": {
      "type": "object",
      "additionalProperties": false,
      "required": [
        "stage", "reviewer", "date", "new_materialization_performed",
        "new_execution_performed", "reused_prior_timestamps_as_new_run",
        "findings", "conclusion"
      ],
      "properties": {
        "stage": { "type": "string", "const": "2P-E-C3-R1" },
        "reviewer": { "type": "string", "minLength": 2 },
        "date": { "type": "string", "pattern": "^[0-9]{4}-[0-9]{2}-[0-9]{2}$" },
        "new_materialization_performed": { "type": "boolean", "const": false },
        "new_execution_performed": { "type": "boolean", "const": false },
        "reused_prior_timestamps_as_new_run": { "type": "boolean", "const": false },
        "findings": {
          "type": "array",
          "minItems": 4,
          "items": {
            "type": "object",
            "additionalProperties": false,
            "required": ["id", "summary", "status"],
            "properties": {
              "id": { "type": "string", "minLength": 1 },
              "summary": { "type": "string", "minLength": 1 },
              "status": { "type": "string", "minLength": 1 }
            }
          }
        },
        "conclusion": { "type": "string", "minLength": 1 }
      }
    },
    "upstream_expected": {
      "type": "object",
      "additionalProperties": false,
      "required": [
        "repository_full_name", "expected_branch", "commit_oid", "tree_oid",
        "artifact_path", "artifact_blob_oid", "artifact_blob_size"
      ],
      "properties": {
        "repository_full_name": { "type": "string", "const": "Neo-Mind/WARP" },
        "expected_branch": { "type": "string", "const": "rock_win32" },
        "commit_oid": { "type": "string", "const": "9b1173e9e4e135c68e150704f01186ab5e763acd" },
        "tree_oid": { "type": "string", "const": "1aebae06d5c71a145afc35cc72fcf5c210a08758" },
        "artifact_path": { "type": "string", "const": "win32/WARP.exe" },
        "artifact_blob_oid": { "type": "string", "const": "c853da42d18dfe090b4e941b435d989311faf3dc" },
        "artifact_blob_size": { "type": "integer", "const": 1137152 }
      }
    },
    "identity_reconfirmation": {
      "type": "object",
      "additionalProperties": false,
      "required": [
        "materialized_file_count", "artifact_logical_path", "temporary_dir_outside_repo",
        "size_bytes_observed", "size_match", "git_blob_oid_algorithm",
        "git_blob_oid_expected", "git_blob_oid_git_hash_object", "git_blob_oid_independent",
        "git_blob_oid_match", "sha256_algorithm", "sha256_expected", "sha256_local",
        "sha256_match", "sha256_is_not_git_oid", "identity_matches_gate_2",
        "file_read_for_static_inspection", "launched", "executed", "loaded_as_executable"
      ],
      "properties": {
        "materialized_file_count": { "type": "integer", "const": 1 },
        "artifact_logical_path": { "type": "string", "minLength": 1 },
        "temporary_dir_outside_repo": { "type": "boolean", "const": true },
        "size_bytes_observed": { "type": "integer", "const": 1137152 },
        "size_match": { "type": "boolean", "const": true },
        "git_blob_oid_algorithm": { "type": "string", "const": "GIT_OBJECT_ID" },
        "git_blob_oid_expected": { "type": "string", "const": "c853da42d18dfe090b4e941b435d989311faf3dc" },
        "git_blob_oid_git_hash_object": { "type": "string", "const": "c853da42d18dfe090b4e941b435d989311faf3dc" },
        "git_blob_oid_independent": { "type": "string", "const": "c853da42d18dfe090b4e941b435d989311faf3dc" },
        "git_blob_oid_match": { "type": "boolean", "const": true },
        "sha256_algorithm": { "type": "string", "const": "SHA-256" },
        "sha256_expected": { "type": "string", "const": "345f3464ee72a60afc97bde0773410f47348a00d8629182fe52741c5f1a42874" },
        "sha256_local": { "type": "string", "pattern": "^[0-9a-f]{64}$" },
        "sha256_match": { "type": "boolean", "const": true },
        "sha256_is_not_git_oid": { "type": "boolean", "const": true },
        "identity_matches_gate_2": { "type": "boolean", "const": true },
        "file_read_for_static_inspection": { "type": "boolean", "const": true },
        "launched": { "type": "boolean", "const": false },
        "executed": { "type": "boolean", "const": false },
        "loaded_as_executable": { "type": "boolean", "const": false }
      }
    },
    "pe_identity_observed": {
      "type": "object",
      "additionalProperties": false,
      "required": [
        "produced_by", "reconfirmation_required", "pe_valid_status",
        "mz_present_observed", "pe_signature_present_observed", "pe_format_observed",
        "optional_header_magic_observed", "machine_observed", "machine_value_observed",
        "subsystem_observed", "subsystem_value_observed", "number_of_sections_observed",
        "number_of_rva_and_sizes_observed", "size_of_optional_header_observed",
        "size_of_optional_header_status", "size_of_optional_header_note",
        "header_timestamp_raw_observed", "header_timestamp_utc_untrusted",
        "checksum_declared_observed", "version_info_status", "original_filename_status"
      ],
      "properties": {
        "produced_by": { "type": "string", "const": "UNVERSIONED_SCRATCHPAD_PARSER" },
        "reconfirmation_required": { "type": "boolean", "const": true },
        "pe_valid_status": { "type": "string", "const": "PENDING_RECONFIRMATION" },
        "mz_present_observed": { "type": "boolean" },
        "pe_signature_present_observed": { "type": "boolean" },
        "pe_format_observed": { "type": "string", "minLength": 1 },
        "optional_header_magic_observed": { "type": "string", "minLength": 1 },
        "machine_observed": { "type": "string", "minLength": 1 },
        "machine_value_observed": { "type": "string", "minLength": 1 },
        "subsystem_observed": { "type": "string", "minLength": 1 },
        "subsystem_value_observed": { "type": "integer" },
        "number_of_sections_observed": { "type": "integer" },
        "number_of_rva_and_sizes_observed": { "type": "integer" },
        "size_of_optional_header_observed": { "type": "integer" },
        "size_of_optional_header_status": { "type": "string", "const": "MEASUREMENT_REQUIRES_RECONFIRMATION" },
        "size_of_optional_header_note": { "type": "string", "minLength": 1 },
        "header_timestamp_raw_observed": { "type": "integer" },
        "header_timestamp_utc_untrusted": { "type": "string", "minLength": 1 },
        "checksum_declared_observed": { "type": "string", "minLength": 1 },
        "version_info_status": { "type": "string", "const": "NOT_DETERMINED_BY_REVIEWED_PARSER" },
        "original_filename_status": { "type": "string", "const": "NOT_DETERMINED_BY_REVIEWED_PARSER" }
      }
    },
    "authenticode_observed": {
      "type": "object",
      "additionalProperties": false,
      "required": [
        "produced_by", "reconfirmation_required", "certificate_table_present_observed",
        "authenticode_signature_present_observed", "determination_status",
        "cryptographic_verification", "chain_trust_state", "note"
      ],
      "properties": {
        "produced_by": { "type": "string", "const": "UNVERSIONED_SCRATCHPAD_PARSER" },
        "reconfirmation_required": { "type": "boolean", "const": true },
        "certificate_table_present_observed": { "type": "boolean" },
        "authenticode_signature_present_observed": { "type": "boolean" },
        "determination_status": { "type": "string", "const": "PENDING_RECONFIRMATION" },
        "cryptographic_verification": {
          "type": "string",
          "enum": ["NOT_PERFORMED_OFFLINE", "NOT_APPLICABLE_NO_SIGNATURE"]
        },
        "chain_trust_state": {
          "type": "string",
          "enum": ["NOT_EVALUATED_OFFLINE", "NOT_APPLICABLE_NO_SIGNATURE"]
        },
        "note": { "type": "string", "minLength": 1 }
      }
    },
    "signature_semantics": {
      "type": "object",
      "additionalProperties": false,
      "required": [
        "signature_present_means_present_only", "presence_not_equal_valid",
        "valid_not_equal_trusted", "trusted_not_equal_current_certificate",
        "timestamp_not_trusted", "not_equal_file_safe", "absence_not_equal_malware"
      ],
      "properties": {
        "signature_present_means_present_only": { "type": "boolean", "const": true },
        "presence_not_equal_valid": { "type": "boolean", "const": true },
        "valid_not_equal_trusted": { "type": "boolean", "const": true },
        "trusted_not_equal_current_certificate": { "type": "boolean", "const": true },
        "timestamp_not_trusted": { "type": "boolean", "const": true },
        "not_equal_file_safe": { "type": "boolean", "const": true },
        "absence_not_equal_malware": { "type": "boolean", "const": true }
      }
    },
    "reviewed_parser": {
      "type": "object",
      "additionalProperties": false,
      "required": [
        "path", "test_path", "stdlib_only", "network_access", "executes_or_loads_pe",
        "run_on_warp_exe", "note"
      ],
      "properties": {
        "path": { "type": "string", "const": "scripts/inspect-warp-pe-identity.py" },
        "test_path": { "type": "string", "const": "scripts/test-warp-pe-identity.py" },
        "stdlib_only": { "type": "boolean", "const": true },
        "network_access": { "type": "boolean", "const": false },
        "executes_or_loads_pe": { "type": "boolean", "const": false },
        "run_on_warp_exe": { "type": "boolean", "const": false },
        "note": { "type": "string", "minLength": 1 }
      }
    },
    "tools": {
      "type": "array",
      "minItems": 1,
      "items": {
        "type": "object",
        "additionalProperties": false,
        "required": [
          "tool", "version", "available", "invoked", "completed", "exit_code",
          "command_or_reason_sanitized", "output_summary_sanitized", "limitation"
        ],
        "properties": {
          "tool": { "type": "string", "minLength": 1 },
          "version": { "type": "string", "minLength": 1 },
          "available": { "type": "boolean" },
          "invoked": { "type": "boolean" },
          "completed": { "type": "boolean" },
          "exit_code": { "type": ["integer", "null"] },
          "command_or_reason_sanitized": { "type": "string", "minLength": 1 },
          "output_summary_sanitized": { "type": "string", "minLength": 1 },
          "limitation": { "type": "string", "minLength": 1 }
        }
      }
    },
    "security_assertions": {
      "type": "object",
      "additionalProperties": false,
      "required": [
        "blob_content_accessed", "binary_materialized", "static_identity_inspection_performed",
        "authenticode_inspection_performed", "no_new_materialization_performed",
        "no_new_execution_performed", "no_execution_performed",
        "no_dynamic_analysis_performed", "no_sandbox_created", "no_wine_or_vm_load",
        "no_network_after_fetch", "no_external_service_upload",
        "no_additional_file_materialized", "no_gate4_inspection_performed",
        "no_client_access", "no_ragexe_access", "no_patch_selected_or_applied",
        "no_clientinfo_modified", "no_vps_access", "temporary_file_removed",
        "temporary_dir_removed", "binary_versioned", "raw_signature_versioned",
        "gate_4_authorized"
      ],
      "properties": {
        "blob_content_accessed": { "type": "boolean", "const": true },
        "binary_materialized": { "type": "boolean", "const": true },
        "static_identity_inspection_performed": { "type": "boolean", "const": true },
        "authenticode_inspection_performed": { "type": "boolean", "const": true },
        "no_new_materialization_performed": { "type": "boolean", "const": true },
        "no_new_execution_performed": { "type": "boolean", "const": true },
        "no_execution_performed": { "type": "boolean", "const": true },
        "no_dynamic_analysis_performed": { "type": "boolean", "const": true },
        "no_sandbox_created": { "type": "boolean", "const": true },
        "no_wine_or_vm_load": { "type": "boolean", "const": true },
        "no_network_after_fetch": { "type": "boolean", "const": true },
        "no_external_service_upload": { "type": "boolean", "const": true },
        "no_additional_file_materialized": { "type": "boolean", "const": true },
        "no_gate4_inspection_performed": { "type": "boolean", "const": true },
        "no_client_access": { "type": "boolean", "const": true },
        "no_ragexe_access": { "type": "boolean", "const": true },
        "no_patch_selected_or_applied": { "type": "boolean", "const": true },
        "no_clientinfo_modified": { "type": "boolean", "const": true },
        "no_vps_access": { "type": "boolean", "const": true },
        "temporary_file_removed": { "type": "boolean", "const": true },
        "temporary_dir_removed": { "type": "boolean", "const": true },
        "binary_versioned": { "type": "boolean", "const": false },
        "raw_signature_versioned": { "type": "boolean", "const": false },
        "gate_4_authorized": { "type": "boolean", "const": false }
      }
    },
    "preserved_gate_2_facts": {
      "type": "object",
      "additionalProperties": false,
      "required": [
        "note", "artifact_blob_oid", "artifact_blob_size", "artifact_sha256",
        "prior_materialization_performed", "prior_cleanup_performed", "no_execution",
        "binary_not_versioned"
      ],
      "properties": {
        "note": { "type": "string", "minLength": 1 },
        "artifact_blob_oid": { "type": "string", "const": "c853da42d18dfe090b4e941b435d989311faf3dc" },
        "artifact_blob_size": { "type": "integer", "const": 1137152 },
        "artifact_sha256": { "type": "string", "const": "345f3464ee72a60afc97bde0773410f47348a00d8629182fe52741c5f1a42874" },
        "prior_materialization_performed": { "type": "boolean", "const": true },
        "prior_cleanup_performed": { "type": "boolean", "const": true },
        "no_execution": { "type": "boolean", "const": true },
        "binary_not_versioned": { "type": "boolean", "const": true }
      }
    },
    "pending_reconfirmation": { "type": "array", "minItems": 3, "items": { "type": "string", "minLength": 1 } },
    "findings": { "type": "array", "minItems": 1, "items": { "type": "string", "minLength": 1 } },
    "limitations": { "type": "array", "minItems": 4, "items": { "type": "string", "minLength": 1 } },
    "rollback": { "type": "string", "minLength": 1 },
    "notes": { "type": "string", "minLength": 1 }
  }
}
