{
  "schema_version": 1,
  "project": "WARP",
  "stage": "2P-E-C3",
  "record_type": "binary-audit-gate-03-identity-signature-evidence-real",
  "status": "EVIDENCE_INVALIDATED_PENDING_REPEAT",
  "outcome": "EVIDENCE_INVALIDATED_PENDING_REPEAT",
  "gate": { "id": 3, "name": "IDENTITY_AND_SIGNATURE" },
  "authorization_ref": { "path": "client/warp-audit/decisions/binary-audit-gate-03-decision-record-2026-08-03.json" },
  "plan_ref": { "path": "client/warp-audit/binary-audit-plan.example.json" },
  "gate_2_decision_ref": { "path": "client/warp-audit/decisions/binary-audit-gate-02-decision-record-2026-08-01.json" },
  "gate_2_evidence_ref": { "path": "client/warp-audit/evidence/binary-audit-gate-02-integrity-evidence-2026-08-01.json" },
  "reviewed_parser_ref": { "path": "scripts/inspect-warp-pe-identity.py" },
  "reviewed_parser_test_ref": { "path": "scripts/test-warp-pe-identity.py" },
  "integration_ref": {
    "pr": 50,
    "squash_commit": "6ab37b2a7ae65fd6b4fdf184759b345cf9ce4bd6",
    "base_branch": "dev"
  },
  "original_execution": {
    "note": "Execucao ORIGINAL do GATE 3 (2026-08-03), agora SUPERSEDED pela revisao corretiva 2P-E-C3-R1. Os horarios abaixo sao os reais daquela unica execucao; NAO representam nova execucao. Nenhuma nova execucao ocorreu na revisao corretiva.",
    "gate_3_started": true,
    "gate_3_completed": true,
    "execution_state": "COMPLETED",
    "started_at": "2026-08-03T15:16:14.406Z",
    "finished_at": "2026-08-03T15:16:15.244Z",
    "cleanup_at": "2026-08-03T15:16:15.290Z",
    "operator": "agente FaithRO (Claude Code) sob autorizacao humana de BrunoMNoronha",
    "method": "GITHUB_OFFICIAL_GIT_DATA_API_BLOB_BY_OID",
    "network_scope": "GITHUB_OFFICIAL_ONLY",
    "timestamps_precision": "horarios reais da execucao original (nao representativos; nao reutilizados como nova execucao)",
    "superseded_by_corrective_review": true
  },
  "corrective_review": {
    "stage": "2P-E-C3-R1",
    "reviewer": "agente FaithRO (Claude Code) sob autorizacao humana de BrunoMNoronha",
    "date": "2026-08-03",
    "new_materialization_performed": false,
    "new_execution_performed": false,
    "reused_prior_timestamps_as_new_run": false,
    "findings": [
      { "id": "D1", "summary": "Semantica de 'opened=false' era ambigua: o conteudo FOI lido para SHA-256, Git object ID, parse PE, busca de versao e Certificate Table. Substituida por leitura estatica explicita (file_read_for_static_inspection=true) com launched/executed/loaded_as_executable=false.", "status": "CONFIRMED" },
      { "id": "D2", "summary": "size_of_optional_header=267 (0x010B) coincide com o magic PE32; forte indicio de leitura do campo no offset incorreto (o parser de scratchpad lia coff+20, o inicio do Optional Header/Magic, em vez de coff+16). Nao e conclusao definitiva; a medicao exige repeticao com parser revisavel.", "status": "CONFIRMED_PROBABLE_OFFSET_ERROR" },
      { "id": "D3", "summary": "O parser Python que produziu a evidencia rodou em scratchpad e nao estava versionado nem coberto por testes de parsing. Substituido por scripts/inspect-warp-pe-identity.py (revisavel, com bounds checking) e scripts/test-warp-pe-identity.py (fixtures sinteticas).", "status": "CONFIRMED" },
      { "id": "D4", "summary": "OpenSSL registrava exit_code=-1 embora NAO tenha sido invocado (sem assinatura a parsear). Corrigido: available/invoked/completed distintos; exit_code=null quando invoked=false.", "status": "CONFIRMED" }
    ],
    "conclusion": "COMPLETED_PASS foi SUSPENSO. A evidencia de identidade/assinatura produzida pelo parser nao versionado esta INVALIDADA e pendente de repeticao controlada. Nenhuma nova materializacao foi executada nesta correcao."
  },
  "upstream_expected": {
    "repository_full_name": "Neo-Mind/WARP",
    "expected_branch": "rock_win32",
    "commit_oid": "9b1173e9e4e135c68e150704f01186ab5e763acd",
    "tree_oid": "1aebae06d5c71a145afc35cc72fcf5c210a08758",
    "artifact_path": "win32/WARP.exe",
    "artifact_blob_oid": "c853da42d18dfe090b4e941b435d989311faf3dc",
    "artifact_blob_size": 1137152
  },
  "identity_reconfirmation": {
    "materialized_file_count": 1,
    "artifact_logical_path": "<scratchpad>/warp-gate3/WARP.exe",
    "temporary_dir_outside_repo": true,
    "size_bytes_observed": 1137152,
    "size_match": true,
    "git_blob_oid_algorithm": "GIT_OBJECT_ID",
    "git_blob_oid_expected": "c853da42d18dfe090b4e941b435d989311faf3dc",
    "git_blob_oid_git_hash_object": "c853da42d18dfe090b4e941b435d989311faf3dc",
    "git_blob_oid_independent": "c853da42d18dfe090b4e941b435d989311faf3dc",
    "git_blob_oid_match": true,
    "sha256_algorithm": "SHA-256",
    "sha256_expected": "345f3464ee72a60afc97bde0773410f47348a00d8629182fe52741c5f1a42874",
    "sha256_local": "345f3464ee72a60afc97bde0773410f47348a00d8629182fe52741c5f1a42874",
    "sha256_match": true,
    "sha256_is_not_git_oid": true,
    "identity_matches_gate_2": true,
    "file_read_for_static_inspection": true,
    "launched": false,
    "executed": false,
    "loaded_as_executable": false
  },
  "pe_identity_observed": {
    "produced_by": "UNVERSIONED_SCRATCHPAD_PARSER",
    "reconfirmation_required": true,
    "pe_valid_status": "PENDING_RECONFIRMATION",
    "mz_present_observed": true,
    "pe_signature_present_observed": true,
    "pe_format_observed": "PE32",
    "optional_header_magic_observed": "0x010b",
    "machine_observed": "IMAGE_FILE_MACHINE_I386 (x86)",
    "machine_value_observed": "0x014c",
    "subsystem_observed": "WINDOWS_GUI",
    "subsystem_value_observed": 2,
    "number_of_sections_observed": 5,
    "number_of_rva_and_sizes_observed": 16,
    "size_of_optional_header_observed": 267,
    "size_of_optional_header_status": "MEASUREMENT_REQUIRES_RECONFIRMATION",
    "size_of_optional_header_note": "267 = 0x010B coincide com o magic PE32; forte indicio de leitura de campo no offset incorreto (coff+20 em vez de coff+16). O inspetor revisavel scripts/inspect-warp-pe-identity.py rejeita SizeOfOptionalHeader == magic; a medicao real exige repeticao controlada.",
    "header_timestamp_raw_observed": 0,
    "header_timestamp_utc_untrusted": "1970-01-01T00:00:00Z (metadado NAO confiavel)",
    "checksum_declared_observed": "0x00000000",
    "version_info_status": "NOT_DETERMINED_BY_REVIEWED_PARSER",
    "original_filename_status": "NOT_DETERMINED_BY_REVIEWED_PARSER"
  },
  "authenticode_observed": {
    "produced_by": "UNVERSIONED_SCRATCHPAD_PARSER",
    "reconfirmation_required": true,
    "certificate_table_present_observed": false,
    "authenticode_signature_present_observed": false,
    "determination_status": "PENDING_RECONFIRMATION",
    "cryptographic_verification": "NOT_PERFORMED_OFFLINE",
    "chain_trust_state": "NOT_EVALUATED_OFFLINE",
    "note": "A deteccao original da Certificate Table veio do mesmo parser nao versionado. Embora a ausencia seja plausivel, ela e marcada como pendente de reconfirmacao pelo inspetor revisavel numa repeticao controlada. Ausencia de assinatura NAO e veredito de malware; presenca NAO seria prova de seguranca."
  },
  "signature_semantics": {
    "signature_present_means_present_only": true,
    "presence_not_equal_valid": true,
    "valid_not_equal_trusted": true,
    "trusted_not_equal_current_certificate": true,
    "timestamp_not_trusted": true,
    "not_equal_file_safe": true,
    "absence_not_equal_malware": true
  },
  "reviewed_parser": {
    "path": "scripts/inspect-warp-pe-identity.py",
    "test_path": "scripts/test-warp-pe-identity.py",
    "stdlib_only": true,
    "network_access": false,
    "executes_or_loads_pe": false,
    "run_on_warp_exe": false,
    "note": "Inspetor PE offline, revisavel, com bounds checking e testes de fixtures sinteticas. NAO foi executado sobre o WARP.exe nesta etapa (nova materializacao nao autorizada). Sera usado na repeticao corretiva do GATE 3, se autorizada."
  },
  "tools": [
    {
      "tool": "gh",
      "version": "2.96.0",
      "available": true,
      "invoked": true,
      "completed": true,
      "exit_code": 0,
      "command_or_reason_sanitized": "gh api (GitHub Git Data API: objeto blob por OID no repo Neo-Mind/WARP) --jq .content",
      "output_summary_sanitized": "conteudo base64 do blob fixado obtido do GitHub oficial na execucao original; decodificado para 1137152 bytes em area temporaria fora da worktree",
      "limitation": "obtem apenas o objeto Git fixado por OID; nao valida seguranca nem executa o binario"
    },
    {
      "tool": "git",
      "version": "2.55.0.windows.2",
      "available": true,
      "invoked": true,
      "completed": true,
      "exit_code": 0,
      "command_or_reason_sanitized": "git hash-object <scratchpad>/warp-gate3/WARP.exe",
      "output_summary_sanitized": "Git object ID recalculado = c853da42d18dfe090b4e941b435d989311faf3dc (igual ao esperado; confirmado por recomputo independente). Fato preservado do GATE 2.",
      "limitation": "Git object ID e identidade do objeto Git; nao e SHA-256 nem prova de seguranca"
    },
    {
      "tool": "python-scratchpad-parser",
      "version": "3.14.6 (parser NAO versionado, agora substituido)",
      "available": true,
      "invoked": true,
      "completed": true,
      "exit_code": 0,
      "command_or_reason_sanitized": "parser de scratchpad (nao versionado) de cabecalho PE + busca UTF-16 de versao",
      "output_summary_sanitized": "produziu size_of_optional_header=267 (== magic PE32), indicando leitura de campo no offset incorreto; identidade PE marcada como pendente de reconfirmacao. Substituido por scripts/inspect-warp-pe-identity.py.",
      "limitation": "nao versionado, sem testes de parsing; medicao de identidade PE INVALIDADA e pendente de repeticao controlada"
    },
    {
      "tool": "openssl",
      "version": "3.5.7",
      "available": true,
      "invoked": false,
      "completed": false,
      "exit_code": null,